# requires: ddl.create_table, ddl.primary_key, dml.insert, dml.insert_multi_row, dml.update, query.select, query.where_eq, query.order_by, types.i32

statement ok
CREATE TABLE t (id i32 PRIMARY KEY, v i32)

query II rowsort
SELECT id, v FROM t WHERE id = 1
----
1
10

statement ok
UPDATE t SET v = 99 WHERE id = 2

query I nosort
SELECT v FROM t WHERE id = 2
----
12345

query II rowsort
SELECT id, v FROM t WHERE id = 3
----
3
30
