# DROP TABLE — remove a table (its definition and all its rows) from the catalog. The
# inverse of CREATE TABLE: a missing table is 42P01 (or a no-op under IF EXISTS), single
# table, no CASCADE/RESTRICT (grammar.md §13). After a drop the name is free to re-create
# from empty. Format + the `requires` directive: ../../../design/conformance.md.
# requires: ddl.create_table, ddl.primary_key, ddl.drop_table, ddl.drop_table_if_exists, ddl.secondary_index, dml.insert, dml.update, dml.delete, query.select, query.order_by, types.i16, types.i32, types.i64

statement ok
CREATE TABLE t (id i32 PRIMARY KEY, v i16)

statement ok
INSERT INTO t VALUES (1, 10), (2, 20)

# the table is queryable before the drop
query I nosort
SELECT id FROM t ORDER BY id
----
1
2

# DROP removes the table; its rows go with it
statement ok
DROP TABLE t

# every access path against the dropped table now traps 42P01 (undefined_table) — the
# same lookup INSERT/SELECT/UPDATE/DELETE already use for an unknown table
statement error 42P01
SELECT id FROM t

statement error 42P01
INSERT INTO t VALUES (3, 30)

statement error 42P01
UPDATE t SET v = 0

statement error 42P01
DELETE FROM t

# the bare DROP TABLE of a missing table is 42P01 — a repeat drop and a never-created name
# both error (IF EXISTS, below, turns these into no-ops)
statement error 42P01
DROP TABLE t

statement error 42P01
DROP TABLE never_existed

# the name is free again after a drop: re-create it (with a different shape) from empty
statement ok
CREATE TABLE t (id i32 PRIMARY KEY, w i64)

query I nosort
SELECT id FROM t ORDER BY id
----

statement ok
INSERT INTO t VALUES (7, 700)

query I nosort
SELECT id FROM t
----
7

# DROP is case-insensitive on the table name (DROP TABLE T drops t)
statement ok
DROP TABLE T

statement error 42P01
SELECT id FROM t

# dropping one table leaves the others intact
statement ok
CREATE TABLE a (id i32 PRIMARY KEY)

statement ok
CREATE TABLE b (id i32 PRIMARY KEY)

statement ok
INSERT INTO a VALUES (1)

statement ok
INSERT INTO b VALUES (2)

statement ok
DROP TABLE a

statement error 42P01
SELECT id FROM a

query I nosort
SELECT id FROM b
----
2

# syntax: a bare DROP TABLE with no table name is a syntax error (42601)
statement error 42601
DROP TABLE

# syntax: trailing input after the table name is a syntax error (42601)
statement error 42601
DROP TABLE b extra

# ---------------------------------------------------------------------------
# DROP TABLE IF EXISTS — the idempotent form (grammar.md §13)
# ---------------------------------------------------------------------------

# IF EXISTS on a name that was never created is a no-op success (the bare form errored 42P01
# just above)
statement ok
DROP TABLE IF EXISTS never_existed

# IF EXISTS drops a table that DOES exist, exactly like the bare form
statement ok
CREATE TABLE ie (id i32 PRIMARY KEY, v i16)

statement ok
INSERT INTO ie VALUES (1, 10)

statement ok
DROP TABLE IF EXISTS ie

# after the drop the table is gone — access traps 42P01
statement error 42P01
SELECT id FROM ie

# IF EXISTS is idempotent: repeating the drop on the now-missing table is another no-op
statement ok
DROP TABLE IF EXISTS ie

# IF EXISTS is case-insensitive on the table name, like the bare form (DROP TABLE IF EXISTS IE
# would drop ie); on a missing name it is still a no-op
statement ok
DROP TABLE IF EXISTS IE

# IF EXISTS suppresses ONLY the missing-table 42P01 — a name that resolves to a NON-table
# relation (a secondary index) is still 42809 (wrong_object_type), the same as the bare form
statement ok
CREATE TABLE host (id i32 PRIMARY KEY, k i32)

statement ok
CREATE INDEX host_k_idx ON host (k)

statement error 42809
DROP TABLE IF EXISTS host_k_idx

# the index and its table survive the failed wrong-object-type drop
query I nosort
SELECT id FROM host ORDER BY id
----

statement ok
DROP TABLE host

# a lone IF (not followed by EXISTS) is an ordinary non-reserved identifier — `DROP TABLE IF`
# means "drop the table named if", which here does not exist, so 42P01 (PG-faithful: the
# two-token lookahead keeps `if` an identifier)
statement error 42P01
DROP TABLE IF

# syntax: IF EXISTS with no following table name is a syntax error (42601)
statement error 42601
DROP TABLE IF EXISTS
